{"$schema":"https://json-schema.org/draft/2020-12/schema","title":"InstallerOwnershipCatalogV1","type":"object","required":["schema_version","record_kind","catalog_id","manifest_entries"],"properties":{"schema_version":{"const":"phase-23.9.installer-ownership-catalog.v1"},"record_kind":{"const":"installer_ownership_catalog"},"catalog_id":{"type":"string","pattern":"^sha256:[a-f0-9]{64}$"},"manifest_entries":{"type":"array","items":{"type":"object","required":["entry_id","provenance","inventory"],"properties":{"entry_id":{"type":"string","pattern":"^sha256:[a-f0-9]{64}$"},"provenance":{"type":"object"},"inventory":{"type":"array"}},"additionalProperties":false}}},"additionalProperties":false}
